{
  "$schema": "http://json-schema.org/draft-07/schema#",
  "$id": "https://models.geonicdb.com/schema/disaster/IncidentResponseAction/v1.0.0.json",
  "title": "IncidentResponseAction",
  "description": "One response action taken for an incident report: assignee, content and completion.",
  "x-version": "1.0.0",
  "x-license-url": "https://models.geonicdb.com/LICENSE-CONTENT",
  "x-model-tags": "GeonicDB, disaster-response, Japan",
  "x-derived-from": "https://github.com/geolonia/geonicdb-datamodels",
  "type": "object",
  "properties": {
    "id": {
      "type": "string",
      "format": "uri",
      "description": "Entity id (URN)"
    },
    "type": {
      "type": "string",
      "const": "IncidentResponseAction",
      "description": "Entity type"
    },
    "task": {
      "description": "The incident report this entity refers to",
      "type": "string",
      "format": "uri",
      "x-ngsi": {
        "type": "Relationship",
        "target": "https://models.geonicdb.com/ns/disaster/IncidentReport"
      },
      "x-iri": "https://models.geonicdb.com/ns/disaster/task",
      "x-geonicdb": {
        "indexed": true
      }
    },
    "assignee": {
      "description": "Assignee, such as a team name",
      "type": "string",
      "x-ngsi": {
        "type": "Property"
      },
      "x-iri": "https://models.geonicdb.com/ns/disaster/assignee"
    },
    "isDone": {
      "description": "Whether the action is done",
      "type": "boolean",
      "x-ngsi": {
        "type": "Property"
      },
      "x-iri": "https://models.geonicdb.com/ns/disaster/isDone"
    },
    "content": {
      "description": "Content",
      "type": "string",
      "x-ngsi": {
        "type": "Property"
      },
      "x-iri": "https://models.geonicdb.com/ns/disaster/content"
    },
    "completedAt": {
      "description": "Completion time",
      "type": "string",
      "format": "date-time",
      "x-ngsi": {
        "type": "Property"
      },
      "x-iri": "https://models.geonicdb.com/ns/disaster/completedAt"
    },
    "updatedAt": {
      "description": "Application-level update time, recorded by the app as a business update, separate from the broker system attribute modifiedAt",
      "type": "string",
      "format": "date-time",
      "x-ngsi": {
        "type": "Property"
      },
      "x-iri": "https://models.geonicdb.com/ns/disaster/updatedAt"
    }
  },
  "required": [
    "id",
    "type",
    "task"
  ],
  "additionalProperties": false
}
